environment,id,statusCode,scenario
prod,ed42afdc-f0d5-4c0d-b428-9fc6ed6e279d,204,Successful responses: No Content
test,ed42afdc-f0d5-4c0d-b428-9fc6ed6e279d,400,Client error responses: Bad Request
dev,ed42afdc-f0d5-4c0d-b428-9fc6ed6e279d,401,Client error responses: Unauthorized
stage,ed42afdc-f0d5-4c0d-b428-9fc6ed6e279d,403,Client error responses: Forbidden
prod,ed42afdc-f0d5-4c0d-b428-9fc6ed6e279d,404,Client error responses: Not Found
test,ed42afdc-f0d5-4c0d-b428-9fc6ed6e279d,429,Client error responses: Too Many Requests
dev,ed42afdc-f0d5-4c0d-b428-9fc6ed6e279d,500,Server error responses: Internal Server Error