 page_size,page_token,statusCode,scenario
20,eyJ0eXBlIjoiZGVmYXVsdCIsImV4cGlyZXMiOjB9,200,Successful responses: OK
20,eyJ0eXBlIjoiZGVmYXVsdCIsImV4cGlyZXMiOjB9,400,Client error responses: Bad Request
20,eyJ0eXBlIjoiZGVmYXVsdCIsImV4cGlyZXMiOjB9,401,Client error responses: Unauthorized
20,eyJ0eXBlIjoiZGVmYXVsdCIsImV4cGlyZXMiOjB9,403,Client error responses: Forbidden
20,eyJ0eXBlIjoiZGVmYXVsdCIsImV4cGlyZXMiOjB9,429,Client error responses: Too Many Requests
20,eyJ0eXBlIjoiZGVmYXVsdCIsImV4cGlyZXMiOjB9,500,Server error responses: Internal Server Error