 cluster_id,topic_name,name,value,statusCode,scenario
cluster1,topic1,test1,test1value,204,Successful responses: No Content
cluster1,topic1,test2,test2value,400,Client error responses: Bad Request
cluster1,topic1,test3,test3value,401,Client error responses: Unauthorized
cluster1,topic1,test4,test4value,403,Client error responses: Forbidden
cluster1,topic1,test5,test5value,404,Client error responses: Not Found
cluster1,topic1,test6,test6value,429,Client error responses: Too Many Requests
cluster1,topic1,test7,test7value,500,Server error responses: Internal Server Error