id,value,display_name,description,filter,statusCode,scenario
iam.max_environments.per_org,R15hoiDIq8Nxu/lY4mPO3DwAVIfU5W7OI+efsB607mLgHTnVW5XJGVqX2ysDx987,flink_compute_pool_0,This quota defines limits on how much the target principals can use cluster lkc-xxxxx,https://api.confluent.cloud/v2/kafka-clusters/lkc-f3a90de,200,Successful responses: OK
ed42afdc-f0d5-4c0d-b428-9fc6ed6e279d,invalid_filter,Invalid Filter,The 'delorean' resource can't be filtered by 'num_doors',num_doors,400,Client error responses: Bad Request
ed42afdc-f0d5-4c0d-b428-9fc6ed6e279d,user_unauthenticated,Authentication Required,Valid authentication credentials must be provided,user_unauthenticated,401,Client error responses: Unauthorized
ed42afdc-f0d5-4c0d-b428-9fc6ed6e279d,quota_exceeded,Kafka Clusters Per Org Quota Exceeded,The request would exceed the quota: kafka_clusters_per_environment,quota_exceeded,402,Client error responses: Payment Required
ed42afdc-f0d5-4c0d-b428-9fc6ed6e279d,user_unauthorized,User Access Unauthorized,The user 'mcfly' is not allowed to access the 'delorean' resource without the 'plutonium' role,user_unauthorized,403,Client error responses: Forbidden
ed42afdc-f0d5-4c0d-b428-9fc6ed6e279d,Not Found,Not Found,Not Found,Not Found,404,Client error responses: Not Found
ed42afdc-f0d5-4c0d-b428-9fc6ed6e279d,invalid_configuration,Validation Failed,The property