cluster_id,topic_name,name,value,statusCode,scenario
cluster1,topic1,ComputePool,R15hoiDIq8Nxu/lY4mPO3DwAVIfU5W7OI+efsB607mLgHTnVW5XJGVqX2ysDx987,204,Successful responses: No Content
cluster2,topic2,ComputePool,R15hoiDIq8Nxu/lY4mPO3DwAVIfU5W7OI+efsB607mLgHTnVW5XJGVqX2ysDx987,400,Client error responses: Bad Request
cluster3,topic3,ComputePool,R15hoiDIq8Nxu/lY4mPO3DwAVIfU5W7OI+efsB607mLgHTnVW5XJGVqX2ysDx987,401,Client error responses: Unauthorized
cluster4,topic4,ComputePool,R15hoiDIq8Nxu/lY4mPO3DwAVIfU5W7OI+efsB607mLgHTnVW5XJGVqX2ysDx987,403,Client error responses: Forbidden
cluster5,topic5,ComputePool,R15hoiDIq8Nxu/lY4mPO3DwAVIfU5W7OI+efsB607mLgHTnVW5XJGVqX2ysDx987,404,Client error responses: Not Found
cluster6,topic6,ComputePool,R15hoiDIq8Nxu/lY4mPO3DwAVIfU5W7OI+efsB607mLgHTnVW5XJGVqX2ysDx987,429,Client error responses: Too Many Requests
cluster7,topic7,ComputePool,R15hoiDIq8Nxu/lY4mPO3DwAVIfU5W7OI+efsB607mLgHTnVW5XJGVqX2ysDx987,500,Server error responses: Internal Server Error