 id,value,group_name,0,statusCode,scenario
<value>,<value>,<value>,<value>,200,Successful responses: OK
<value>,<value>,<value>,<value>,400,Client error responses: Bad Request
<value>,<value>,<value>,<value>,401,Client error responses: Unauthorized
<value>,<value>,<value>,<value>,403,Client error responses: Forbidden
<value>,<value>,<value>,<value>,404,Client error responses: Not Found
<value>,<value>,<value>,<value>,422,Client error responses: Unprocessable Entity
<value>,<value>,<value>,<value>,429,Client error responses: Too Many Requests
<value>,<value>,<value>,<value>,500,Server error responses: Internal Server Error